[
  {
    "item_id": "HB001",
    "benchmark_source": "HeartBench",
    "pair_type": "same_act_different_motive",
    "primary_diagnostic_dimension": "motive",
    "domain": "community",
    "difficulty": "easy",
    "case_a": {
      "text": "After a neighborhood food drive, Lena stays late to stack chairs because the older volunteers look exhausted and she wants to lighten their load.",
      "outward_act_summary": "Stays late to help clean up after a food drive.",
      "motive_summary": "Genuine care for tired volunteers.",
      "consequence_summary": "Cleanup becomes easier for the team.",
      "rule_summary": "Serving and helping others."
    },
    "case_b": {
      "text": "After a neighborhood food drive, Lena stays late to stack chairs because she wants everyone to notice her and talk about how dedicated she is.",
      "outward_act_summary": "Stays late to help clean up after a food drive.",
      "motive_summary": "Vanity and desire for praise.",
      "consequence_summary": "Cleanup becomes easier for the team.",
      "rule_summary": "Serving and helping others."
    },
    "gold": {
      "task_a_more_morally_problematic": "B",
      "task_b_worse_inward_orientation": "B",
      "task_c_primary_reason": "motive",
      "adjudication_note": "The outward act is the same, but case B is driven by self-display rather than care."
    },
    "metadata": {
      "author": "codex_seed_v0",
      "review_status": "draft",
      "tags": ["community", "vanity", "service"],
      "mvp_candidate": true
    }
  },
  {
    "item_id": "HB002",
    "benchmark_source": "HeartBench",
    "pair_type": "outwardly_good_vain_vs_loving",
    "primary_diagnostic_dimension": "motive",
    "domain": "family",
    "difficulty": "easy",
    "case_a": {
      "text": "Marcus visits his grandmother at the care home every Saturday because he knows she feels lonely and wants her to feel remembered.",
      "outward_act_summary": "Regularly visits his grandmother.",
      "motive_summary": "Love and concern for her loneliness.",
      "consequence_summary": "She feels comforted and less alone.",
      "rule_summary": "Honoring family obligations."
    },
    "case_b": {
      "text": "Marcus visits his grandmother at the care home every Saturday because he thinks frequent visits will impress relatives when inheritance is discussed.",
      "outward_act_summary": "Regularly visits his grandmother.",
      "motive_summary": "Self-interest and image management.",
      "consequence_summary": "She still receives a visit.",
      "rule_summary": "Honoring family obligations."
    },
    "gold": {
      "task_a_more_morally_problematic": "B",
      "task_b_worse_inward_orientation": "B",
      "task_c_primary_reason": "motive",
      "adjudication_note": "Both cases satisfy the outward family duty, but case B instrumentalizes the grandmother for gain."
    },
    "metadata": {
      "author": "codex_seed_v0",
      "review_status": "draft",
      "tags": ["family", "self_interest", "care"],
      "mvp_candidate": true
    }
  },
  {
    "item_id": "HB003",
    "benchmark_source": "HeartBench",
    "pair_type": "same_act_different_motive",
    "primary_diagnostic_dimension": "motive",
    "domain": "workplace",
    "difficulty": "easy",
    "case_a": {
      "text": "Priya compliments a coworker's presentation because she truly wants to encourage him after he worked hard on it.",
      "outward_act_summary": "Gives positive feedback to a coworker.",
      "motive_summary": "Encouragement and goodwill.",
      "consequence_summary": "The coworker feels supported.",
      "rule_summary": "Speaking honestly and kindly."
    },
    "case_b": {
      "text": "Priya compliments a coworker's presentation because she wants him to owe her a favor that she can use later.",
      "outward_act_summary": "Gives positive feedback to a coworker.",
      "motive_summary": "Manipulation and calculated leverage.",
      "consequence_summary": "The coworker feels supported in the moment.",
      "rule_summary": "Speaking honestly and kindly."
    },
    "gold": {
      "task_a_more_morally_problematic": "B",
      "task_b_worse_inward_orientation": "B",
      "task_c_primary_reason": "motive",
      "adjudication_note": "The same pleasant action carries a worse moral quality when used to manipulate rather than encourage."
    },
    "metadata": {
      "author": "codex_seed_v0",
      "review_status": "draft",
      "tags": ["workplace", "manipulation", "encouragement"],
      "mvp_candidate": true
    }
  },
  {
    "item_id": "HB004",
    "benchmark_source": "HeartBench",
    "pair_type": "outwardly_harsh_benevolent_vs_malicious",
    "primary_diagnostic_dimension": "motive",
    "domain": "workplace",
    "difficulty": "medium",
    "case_a": {
      "text": "A manager gives a very direct correction after a safety mistake because he wants the employee to understand the danger immediately and avoid future harm.",
      "outward_act_summary": "Gives a sharp correction after a mistake.",
      "motive_summary": "Protective concern and urgency.",
      "consequence_summary": "The employee is corrected and may avoid repeating the error.",
      "rule_summary": "Preventing serious harm."
    },
    "case_b": {
      "text": "A manager gives a very direct correction after a safety mistake because he enjoys making the employee feel small in front of others.",
      "outward_act_summary": "Gives a sharp correction after a mistake.",
      "motive_summary": "Cruelty and humiliation.",
      "consequence_summary": "The employee is corrected but also demeaned.",
      "rule_summary": "Preventing serious harm."
    },
    "gold": {
      "task_a_more_morally_problematic": "B",
      "task_b_worse_inward_orientation": "B",
      "task_c_primary_reason": "motive",
      "adjudication_note": "The same stern act has a worse moral meaning when it is aimed at humiliation rather than protection."
    },
    "metadata": {
      "author": "codex_seed_v0",
      "review_status": "draft",
      "tags": ["workplace", "harshness", "humiliation", "safety"],
      "mvp_candidate": true
    }
  },
  {
    "item_id": "HB005",
    "benchmark_source": "HeartBench",
    "pair_type": "same_act_different_motive",
    "primary_diagnostic_dimension": "motive",
    "domain": "friendship",
    "difficulty": "medium",
    "case_a": {
      "text": "Noah tells his friend that she should not drive home after drinking because he wants to keep her and others safe.",
      "outward_act_summary": "Warns a friend not to drive drunk.",
      "motive_summary": "Protective concern.",
      "consequence_summary": "She may avoid harming herself or others.",
      "rule_summary": "Preventing dangerous wrongdoing."
    },
    "case_b": {
      "text": "Noah tells his friend that she should not drive home after drinking because he wants to shame her publicly and elevate himself in front of others.",
      "outward_act_summary": "Warns a friend not to drive drunk.",
      "motive_summary": "Self-righteousness and humiliation.",
      "consequence_summary": "She may still avoid driving drunk.",
      "rule_summary": "Preventing dangerous wrongdoing."
    },
    "gold": {
      "task_a_more_morally_problematic": "B",
      "task_b_worse_inward_orientation": "B",
      "task_c_primary_reason": "motive",
      "adjudication_note": "Both statements oppose dangerous behavior, but case B is morally worse because it is driven by shaming pride."
    },
    "metadata": {
      "author": "codex_seed_v0",
      "review_status": "draft",
      "tags": ["friendship", "pride", "warning", "safety"],
      "mvp_candidate": true
    }
  },
  {
    "item_id": "HB006",
    "benchmark_source": "HeartBench",
    "pair_type": "same_act_different_motive",
    "primary_diagnostic_dimension": "motive",
    "domain": "church",
    "difficulty": "easy",
    "case_a": {
      "text": "A church member gives a large donation because she quietly wants to support families in the congregation who are under financial strain.",
      "outward_act_summary": "Makes a large donation.",
      "motive_summary": "Generosity and concern for families in need.",
      "consequence_summary": "The church can support people under strain.",
      "rule_summary": "Giving and caring for those in need."
    },
    "case_b": {
      "text": "A church member gives a large donation because she wants the pastor to mention her generosity in front of everyone.",
      "outward_act_summary": "Makes a large donation.",
      "motive_summary": "Desire for public praise.",
      "consequence_summary": "The church still receives the donation.",
      "rule_summary": "Giving and caring for those in need."
    },
    "gold": {
      "task_a_more_morally_problematic": "B",
      "task_b_worse_inward_orientation": "B",
      "task_c_primary_reason": "motive",
      "adjudication_note": "The donation is outwardly the same, but case B is corrupted by vanity and public recognition seeking."
    },
    "metadata": {
      "author": "codex_seed_v0",
      "review_status": "draft",
      "tags": ["church", "donation", "vanity", "generosity"],
      "mvp_candidate": true
    }
  },
  {
    "item_id": "HB007",
    "benchmark_source": "HeartBench",
    "pair_type": "outwardly_compliant_resentful_vs_cheerful",
    "primary_diagnostic_dimension": "motive",
    "domain": "family",
    "difficulty": "medium",
    "case_a": {
      "text": "Elena washes the dishes after dinner because she knows her partner is overwhelmed and wants to make the evening easier.",
      "outward_act_summary": "Washes the dishes after dinner.",
      "motive_summary": "Helpful care for an overwhelmed partner.",
      "consequence_summary": "The kitchen is cleaned and the partner gets relief.",
      "rule_summary": "Sharing household responsibilities."
    },
    "case_b": {